model,level,item_id,response,rouge_l
qwen3,3,689,기획재정부는 우크라이나 사태와 글로벌 공급망 차질로 인해 물가 상승 압력이 지속될 것으로 예상했다. 6월 소비자물가지수는 전년 대비 6% 상승하며 1998년 이후 23년 만에 최고 수준을 기록했다. 전망상 물가 상승률이 7~8%에 이를 가능성도 제기되었다.,0.23529411764705882
qwen3,3,702,"부산 해운대구 우동에 위치한 주거용 오피스텔 '한라비발디 펜트빌'이 이달 중 분양 예정이다. 해당 오피스텔은 지하 5층 지상 35층 규모로, 교통과 생활 인프라가 풍부한 지역에 위치해 있다. 주변에는 다양한 상업 시설과 복합 문화 공간이 조성되어 있어 편리한 주거 환경을 제공한다.",0.30303030303030304
qwen3,3,715,국토부 장관은 산하 28곳 공공기관의 혁신안에 문제의식 부족을 지적하고 민관 TF를 구성해 개혁을 추진하겠다고 밝혔다. 대부분의 혁신 방안이 경영 효율화에 초점이 맞춰져 있어 부족하다고 판단했다. 내외부 이해관계 유착을 막기 위한 조치를 8월까지 마련할 계획이다.,0.256
qwen3,3,755,"고승범 금융위원장은 짧은 재임기간 동안 가계부채 증가율을 낮추는 데 집중하며 금융안정을 추구했다. 그는 사의 표명 두 달 만에 이임식을 열고, 김주현 후보자 청문보고서 송부 요청이 국회에 재요청된 상황이다.",0.22222222222222224
qwen3,3,82,"HBO 다큐멘터리 '세기의 범죄'는 미국의 오피오이드 중독 위기의 원인을 조사하며, 제약사와 의사, 정부의 연계된 계획을 고발한다. 이 사태는 2000년대 이후 마약성 진통제의 과도한 처방과 오남용으로 인해 수십만 명의 사망을 초래했다. 제약사와 관련 기관이 책임을 인정하며 30조원 이상의 합의금을 지불했다.",0.16915422885572137
qwen3,3,826,IBS는 대전 본원에 생명과학 연구클러스터를 7월 1일 출범시키고 이창준 인지 및 사회성 연구단장을 연구소장으로 임명했다. 이 클러스터는 3개 연구단이 합쳐져 연구협력을 강화하고 시너지를 창출하는 것이 목표이다. IBS는 연구클러스터를 통해 국가 전략 연구분야를 육성하고 연구경쟁력을 높이겠다고 밝혔다.,0.4444444444444444
qwen3,3,838,"1주택자는 재산세가 크게 줄어들었지만, 2주택자는 공시가격 상승으로 세 부담이 늘어나고 있다.  
정부의 보유세 개편으로 1주택자에게 세 감면 효과가 커지면서 다주택자들의 불만이 커지고 있다.  
주택 가액을 기준으로 세금을 매기는 방안이 제기되고 있다.",0.1839080459770115
qwen3,3,86,"톰 레이턴 아카마이 CEO는 해킹 위협이 전통적인 악성코드와 랜섬웨어로 급증하고 있으며, 특히 클라우드 보안이 중요하다고 강조했다. 아카마이는 마이크로세그멘테이션 기술을 통해 24시간 해킹 탐지와 피해 예방을 가능하게 하고 있으며, 보안 매출이 급성장 중이라고 밝혔다.",0.3972602739726028
qwen3,3,866,이창양 산업통상자원부 장관은 반도체와 연관된 산업을 '반도 semiconductor 플러스 산업'으로 육성해 경제 효과를 확대할 방침이라고 밝혔다. 또한 세계적인 인플레이션과 에너지 쇼크를 극복하기 위해 수출 경쟁력 강화와 원전 활용을 강조했다. 규제 개혁과 세액공제를 통해 생산성 향상과 일자리 창출을 추진할 계획이라고 전했다.,0.2894736842105263
qwen3,3,872,"한국 경제가 3분기 마이너스 성장률을 기록하며 1년 내 경기후퇴에 진입할 전망이다. 세계 경제 성장 둔화로 인해 수출 의존도가 높은 한국의 위험성이 커지고 있으며, 글로벌 투자자들이 아시아 증시에서 대규모 자본을 회수하고 있다.",0.1846153846153846
qwen3,3,902,신한저축은행이 7월 기업윤리 부문 공정거래위원회 위원장상을 수상했다. 이는 지속가능경영을 선진적으로 실천한 기업에 주는 ‘국가지속가능경영 대상’에서 수여된 상이다. 신한저축은행은 윤리경영과 고객중심의 금융을 통해 사회적 책임을 다하고 있다고 밝혔다.,0.2895927601809955
qwen3,3,915,"탈잉 2분기 인기 검색어 1위는 댄스로, 퍼스널 컬러와 보컬 메이크업 등 취미 트렌드가 주목받았다. 직무 역량 관련 키워드도 상승하며 자기계발 관심이 높아졌고, 부동산 키워드의 등장은 하반기 시장 활성화 기대를 반영했다.",0.20634920634920634
qwen3,3,97,"나이벡 주가가 3.08% 오른 2만3400원에 거래되고 있다. 회사는 펩타이드 기반 조직재생 바이오 소재가 하반기 임상에 진입한다. 정부 지원을 받아 연구개발을 진행 중이며, 기술이전 및 상용화를 가속화할 계획이다.",0.2903225806451613
qwen3,3,101,"bhc치킨은 해바라기 봉사단을 통해 2022년 상반기 12회에 걸쳐 다양한 봉사활동을 펼쳤다. 사회공헌 프로그램 BSR의 일환으로 운영되는 이 봉사단은 대학생 자원봉사단체로, 대면 활동을 본격화하며 사회적 가치를 확산하고 있다. 또한, 가맹점과 함께 치킨 기부 릴레이를 통해 지역사회에 따뜻한 나눔을 실천했다.",0.273972602739726
qwen3,3,1044,금감원 직원들의 평가상여금이 4년 만에 600만원대로 회복됐다. 경영평가 결과는 내부에만 공개되어 개선 방향이 모호하다는 지적이다. 민원·분쟁조정 만족도는 전년 대비 하락하며 개선이 필요하다는 의견이 제기되고 있다.,0.21568627450980388
qwen3,3,1054,"손태승 우리금융회장이 자사주 5000주를 매입해 총 보유 주식 수를 늘렸다. 이는 올 들어 세 번째 자사주 매입으로, 주가 저평가 시 기업 가치 제고 의지를 보여주는 것으로 평가받고 있다. 또한, 손 회장은 글로벌 IR 활동을 통해 해외 투자자들의 관심을 끌고 있다.",0.3522012578616352
qwen3,3,1064,"테슬라의 비트코인 평가액이 3개월 만에 5700억원 가량 급락했다. 비트코인 가격 폭락으로 테슬라의 자산 가치가 크게 줄었으나, 회계상 손실로 반영되지 않아 수익에 직접적인 영향은 미치지 않는다. 테슬라와 마이크로스트래티지 등 기업들이 비트코인 투자로 큰 손실을 입었다.",0.2074074074074074
qwen3,3,1096,전진바이오팜은 포파코와 10억원 규모의 반려동물용품 공급계약을 체결했다. 네이처플랜은 첫 프리미엄 사료 브랜드로 반려동물의 건강을 위한 내츄럴 레시피를 제공한다. 해당 사료는 고함량 오메가3와 유기농 식물성 단백질을 함유하며 HACCP 인증을 받았다.,0.47482014388489213
qwen3,3,1112,한덕수 국무총리는 팜 민 찐 베트남 총리와 통화를 통해 양국 관계 격상과 경제협력 강화를 논의했다. 양측은 2030 부산 세계박람회와 FTA·RCEP 등 플랫폼을 활용해 교역 규모 1천억 달러 달성과 협력을 확대하기로 했다. 양국은 외교 경로를 통해 상호 방문을 요청하며 관계 발전을 기대했다.,0.19444444444444442
qwen3,3,1124,"올해 상반기 아파트 청약 경쟁률은 지난해 대비 전반적으로 하락했다. 수도권에서는 경쟁률과 당첨 가점이 크게 줄어들었고, 대구는 당첨 최소 가점이 0점으로 떨어졌다. 정부의 규제지역 조정으로 하반기에는 일부 지역에서 청약 경쟁률 상승이 예상된다.",0.22988505747126434
qwen3,3,1137,"바이오니아가 유럽 체외진단 의료기기 인증을 위한 임상평가 과제에 선정되어 CE IVDR 인증 획득을 목표로 한다. 이 과정에서 유럽 임상 비용을 절감하고 국내 기업의 국제 임상 기회를 확대할 계획이다. 또한, 상온 보관 가능한 진단키트 개발을 통해 ExiStation FA 96 384의 효율성과 글로벌 시장 진출을 가속화할 방침이다.",0.3614457831325302
qwen3,3,1151,"올 여름은 평년보다 더 더울 것으로 예보되어 에어컨 사용이 늘어나고 있다. 전력 공급은 과거 수준으로, 예비율이 10%를 넘지 못해 전력난 위험이 있다. 전력거래소는 8월에는 예비율이 5.2기가와트까지 떨어질 수 있다고 경고했다.",0.35428571428571426
qwen3,3,1174,"정부가 정보통신공사업법 시행령을 개정해 대기업 공사업자 기준과 도급 금액 하한을 명확히 했다. 무자격자의 광고 행위에 과태료를 부과하고, 전자형 자격증과 신규 자격종목을 도입했다. 이는 중소기업 보호와 시장질서 정비를 목표로 한다.",0.303030303030303
qwen3,3,1181,"보험사들은 미니보험의 낮은 수익성과 진입 장벽으로 인해 디지털 보험사 설립을 주저하고 있다. 소액단기보험사 설립 요건은 완화되었지만, 여전히 인적·물적 요건과 고정자본금 규제로 진입이 어렵다. 미니보험 시장은 커지고 있지만, 수익성 부족으로 보험사 실적에 미치는 영향이 작다.",0.2808988764044944
qwen3,3,1309,한국생명공학연구원과 원광대학교병원이 바이오의약 분야 발전을 위해 업무협약을 체결했다. 양 기관은 연구 협력과 인적 교류를 통해 연구역량과 교육 경쟁력을 강화할 계획이다. 이 협약을 통해 의료 빅데이터와 개인 맞춤형 치료 개발 등 혁신 기술 연구에 공동으로 나선다.,0.396694214876033
qwen3,3,1317,"현대제철은 2022년 디지털 통합 보고서 '비욘드 스틸'을 발간하며 ESG 경영 성과를 공개했다. 보고서는 환경, 사회, 지배구조 등 분야별 활동과 데이터를 세분화해 투명하게 제시했다. 또한 디지털화로 탄소 배출 감소와 정보 접근성 향상에 기여하고 있다.",0.30973451327433627
qwen3,3,1318,"EU는 미국의 OFAC와 유사한 외국 경제·무역 제재 기구 설치를 검토 중이다. 이 기구는 회원국의 제재 이행을 지원하고, 자금세탁 방지 기구에 제재 감독 권한을 부여할 수 있다. 현재 EU의 제재 이행은 각 회원국에 따라 차이가 있으며, 일부 국가에서는 강력한 인프라가 부족하다.",0.4385026737967914
qwen3,3,139,CJ ENM은 최첨단 기술을 활용한 버추얼 프로덕션 스튜디오를 구축해 콘텐츠 제작 방식을 혁신하고 있다. 이 스튜디오에서는 마이크로LED 벽을 통해 가상 배경을 실시간으로 구현해 해외 촬영의 시간과 비용을 절감할 수 있다. SK텔레콤도 유사한 스튜디오를 개소해 국내외 실시간 협업을 가능하게 했다.,0.24870466321243526
qwen3,3,1410,"정부는 역동적이고 혁신적인 플랫폼 생태계 구축을 위해 범부처 플랫폼 정책협의체를 구성하고 민간 자율규제를 중심으로 규제 체계를 마련할 계획이다. 자율규제를 제도화하고, 다양한 분과별 규약을 통해 플랫폼 시장의 건전한 성장을 지원할 방침이다. 이는 민간과 정부의 협력으로 플랫폼 이용환경을 개선하고 지속 가능한 시장 구축을 목표로 한다.",0.2011173184357542
qwen3,3,1424,"루닛이 일본 시장에 성공적으로 진출하며, 출시 6개월 만에 도입 병원 100곳을 돌파했다. 일본 내 다양한 규모의 의료기관에서 제품을 도입하며 매출 성장이 기대된다. 전 세계 600곳 이상의 의료기관에서 사용 중인 루닛의 AI 영상진단 솔루션은 글로벌 확장에 박차를 가하고 있다.",0.3575418994413408
qwen3,3,1442,"노랑풍선은 코로나19로 인해 신혼여행을 못한 고객들을 위해 마이 허니문 기획전을 진행한다. 9월부터 12월까지 출발 가능하며, 다양한 여행 스타일(휴양형, 관광형, 복합형)의 상품을 제공한다. 고객에게는 캐리어 세트나 소형 인덕션 등 선물도 제공된다.",0.2802547770700637
qwen3,3,146,"2022년 6월 소비자물가 상승률이 6%로 1998년 외환위기 이후 최고치를 기록했다. 국제 에너지·곡물가 상승과 공급망 차질이 물가 상승을 지속시키고 있다. 정부는 민생안정을 위해 추가 대책을 마련하고, 생활물가 안정과 서민 지원을 강화하고 있다.",0.35802469135802467
qwen3,3,1585,"NH투자증권은 포스코홀딩스의 목표주가를 37만원에서 31만원으로 하향 조정하며 투자의견을 매수로 유지했다. 하반기 철강 가격 하락과 여름 비수기 영향으로 실적 약세가 예상되나, 2분기 영업이익은 시장 기대치를 상회할 것으로 분석했다. 중국 인프라 투자 기대에도 철강 시황은 재고 조정과 가격 약세로 압박받을 전망이다.",0.3850931677018633
qwen3,3,1676,"암호화폐 폭락으로 미국 흑인 투자자들이 큰 손실을 입었지만, 여전히 투자 열기가 높다. 흑인 투자자들이 암호화폐에 더 많이 참여한 이유는 진입장벽이 낮고 수수료가 저렴하기 때문이다. 흑인 투자자들은 암호화폐를 통해 경제적 기회를 잡기 위한 의지가 강하다.",0.2331288343558282
qwen3,3,17,"수도권 레미콘 운송노조가 운송료 27% 인상 요구로 파업에 돌입해 150여 공장 가동 중단. 노조와 제조사 간 협상은 결렬되고 장기화 가능성도 제기. 파업으로 건설업계에 피해가 확대되고, 공기 연장과 입주 일정 지연 등이 우려된다.",0.31746031746031744
qwen3,3,1705,"카카오 노조는 카카오모빌리티 사모펀드 매각 반대를 위한 서명 운동을 재개하고, 후속 단체행동을 예고했다. 노조는 매각 시 사업 철수를 선언하며 사회적 책임을 이행하지 않는다고 비판했다. 카카오 측은 매각 여부를 결정하지 않았으며 다양한 의견을 수렴해 결정할 방침이라고 밝혔다.",0.32894736842105254
qwen3,3,1725,"미국인 4800만 명이 독립기념일 연휴에 장거리 여행을, 1300만 명이 항공여행을 계획 중이다. 항공 수요는 팬데믹 전 수준으로 회복되고 있지만, 결항과 지연으로 여행객들이 곤란을 겪고 있다. 특히 주요 공항에서는 대규모 혼잡이 예상된다.",0.28750000000000003
qwen3,3,1751,이스타항공의 항공운항증명 승인은 회계자료 허위제출 의혹으로 다시 연기될 전망이다. 국토부는 이스타항공이 제출한 자료에 자본잠식 사실을 반영하지 않았다고 지적하며 특별조사에 들어갔다. 이스타항공은 회생절차 중 회계시스템 폐쇄로 인해 특정 수치를 반영했다고 설명했다.,0.2465753424657534
qwen3,3,1796,"한미글로벌이 사우디아라비아 디리야 지역 개발 프로젝트 PM용역을 수주해 2027년까지 주택 및 상업단지 조성을 담당한다. 수주 금액은 약 440억 원으로, 지난해 매출의 16%에 해당한다. 이 프로젝트는 사우디 왕세자 주도의 대규모 주거 복합단지 개발 사업이다.",0.2231759656652361
qwen3,3,1830,카카오노조는 카카오모빌리티 매각 반대 서명운동을 재개하며 사측과의 갈등을 이어가고 있다. 양측은 매각 여부와 사업 방향에 대해 의견 차이를 보이며 협상이 결론을 내리지 못했다. 카카오는 매각 여부를 아직 결정하지 않았으며 사회적 책임과 이해관계자 의견을 고려할 방침이다.,0.25882352941176473
qwen3,3,1835,"컬리가 예비상장심사 통과를 위해 재무적 투자자들의 의무보유확약서를 제출하며 상장 절차를 가속화하고 있다. 이에 따라 이달 말 예비심사 통과가 예상되나, 증시 상황과 기업 가치 평가 차이로 공모가 산정에 진통이 예상된다.",0.3176470588235294
qwen3,3,1867,"코스피 하락 추세가 내년 1분기까지 지속될 전망이며, 경기 침체 가능성과 글로벌 금융시장 변동성 확대가 주요 요인이다. 대신증권은 2050선을 장기 하단으로 제시하며 방어적 투자 전략을 권장했다. 7월 증시는 기술적 반등과 물가 정점 통과 기대감을 중심으로 움직일 것으로 분석했다.",0.24999999999999994
qwen3,3,1875,"LG유플러스와 노키아는 5G 어드밴스드 및 6G 분야에서 공동 연구개발을 강화하기로 했다. 양사는 네트워크 구조와 주파수 확장 등 기술 개발을 위해 협력할 계획이며, 오픈랜 기술 연구를 통해 통신사의 네트워크 유연성과 산업 혁신 기회를 창출할 예정이다.",0.4626865671641791
qwen3,3,1899,"대우조선해양은 ESG 경영 강화를 위해 ESG위원회를 신설하고 통합보고서를 발간하며 체계적인 실행 체계를 마련했다. 이 위원회는 ESG 전략과 활동을 심의하며, 내외부 소통을 강화한 보고서를 통해 지속가능경영을 추진하고 있다. 최경규 위원장은 ESG 경영 표준 마련을 목표로 하고 있다.",0.27878787878787875
qwen3,3,1923,환경부는 수도법 시행령과 시행규칙을 개정해 수도계획을 통합하고 수도시설 관리 및 안전성을 강화했다. 이로 인해 국가수도기본계획을 올해 연말까지 수립할 계획이다. 또한 주민 의견청취와 행정효율을 높이기 위한 다양한 조치를 도입했다.,0.29139072847682124
qwen3,3,1956,"애플이 아이폰14 일반 모델에 A15바이오닉 칩을 재사용하고, 프로 모델에는 A16칩을 탑재할 것으로 보입니다. 이는 칩 개발 속도 저하와 비용 절감을 위한 전략으로 해석됩니다. 또한, TSMC의 주문 부족과 소비자 지갑 닫기 상황도 영향을 미쳤습니다.",0.3181818181818182
qwen3,3,1976,"A1 Pictures와 카카오엔터테인먼트가 협업해 '나혼자만 레벨업' 애니메이션 제작을 발표했다. 이 작품은 웹툰과 게임 등으로 확장된 대표 IP로, 2023년에 방영 예정이다. 원작자와 작가들은 애니메이션화 소식에 기대감을 드러냈다.",0.319327731092437
qwen3,3,1988,"HP 엔비 x360 15 투인원 두 모델이 국내 출시되었다. 15.6인치 OLED 디스플레이와 스타일러스 펜, 다양한 모드 조절 기능을 갖췄으며, 30분 충전으로 50% 충전이 가능하다. 무게 1.64kg, 두께 18.6mm, 윈도11 홈 운영체제가 기본 탑재되었다.",0.1818181818181818
qwen3,3,2011,"NASA의 캡스톤 위성이 지구와의 통신을 잃고 궤도 진입 중인 상태이다. 이 위성은 아르테미스 프로그램의 일환으로 달 우주정거장 '게이트웨이'의 궤도를 테스트하는 임무를 수행할 예정이다. NASA는 위성의 경로를 추적 중이며, 재연결을 시도하고 있다.",0.16352201257861634
qwen3,3,2016,"컴투스는 8월 16일 국내에서 MMORPG '서머너즈 워 클로니클'을 출시하고, 하반기 중 글로벌 시장에서 P2O 게임으로 선보일 계획이다. 이 게임은 전 세계 1억5000만 다운로드를 기록한 서머너즈 워 IP를 계승하며, 유저가 게임 결과물을 소유할 수 있는 새로운 게임 경험을 제공한다. 클로니클은 서머너즈 워 유니버스 확장의 시작점으로, 다양한 콘텐츠로 확장될 예정이다.",0.26436781609195403
qwen3,3,2045,"보그인터내셔날과 카타나골프가 골프기어 사업에 관한 양해각서를 체결했다. 보그인터내셔날은 보그너 브랜드의 골프클럽을 제작·판매할 계획이며, 카타나골프는 기술력을 제공한다. 양사는 협력 통해 골프클럽 시장에 시너지를 창출할 방침이다.",0.4651162790697675
qwen3,3,2068,"분양가상한제 개편으로 정책 불확실성이 해소되면서 7월 전국 3만9655가구가 일반분양 예정이다. 대구는 조정대상지역 해제로 5050가구를 분양하며 가장 많은 물량을 공급할 전망이다. 다만, 규제 해제만으로는 공급 증가에 한계가 있다는 지적이다.",0.16374269005847955
qwen3,3,2085,"대한항공과 다른 항공사들이 국제선 운항을 재개하고 있지만, 전문 인력의 복귀는 여전히 지연되고 있다. 코로나19로 인한 휴직자 비율이 높아 현장 복귀가 어려운 상황이다. 국제선 운항률은 코로나19 전 수준에 비해 여전히 낮아 항공사의 수익 회복도 한참 남아 있다.",0.24390243902439024
qwen3,3,2102,"JB금융지주가 바젤Ⅲ 기준 내부등급법을 최종 승인받아 자본비율 개선이 기대된다. 이는 지주와 전북은행이 동시에 승인받은 첫 사례로, 지역 경제 활성화와 주주 친화 정책에 긍정적 영향을 줄 것으로 보인다.",0.37837837837837834
qwen3,3,2145,"현대엘리베이터가 2022년 임금협상을 조기 타결하며 역대 최고 찬성율 83.21%를 기록했다. 기본급 3.8% 인상과 무분규 타결, 특별 격려금 지급 등을 합의했다. 노사는 위기극복을 위한 결의대회를 열고 공동 결의문을 채택하며 협력과 성장을 위한 의지를 표명했다.",0.26143790849673204
qwen3,3,2152,내년 최저임금이 9620원으로 5% 인상되어 1월 1일부터 적용된다. 유류세 인하폭이 확대되며 휘발유와 경유 가격이 각각 516원과 369원 인하된다. 기대 인플레이션이 3.9%로 10년 만에 최고치를 기록했다.,0.1863354037267081
qwen3,3,2155,"코오롱생명과학이 인보사 논란으로 25억원 연구비 환수 조치를 취소하려는 소송에서 항소심에서도 승소했다. 재판부는 연구비 환수 처분이 재량권 남용으로 판단되며, 연구 과제 대부분이 성공했다고 보았다. 이 판결로 코오롱 측의 부정행위 의혹은 상당 부분 해소되었다.",0.29585798816568043
qwen3,3,216,"애큐온캐피탈은 2022년 UNGC 이행보고서를 제출하며 ESG 경영 성과를 공개했다. 2021년 ESG 채권 발행을 통해 녹색 프로젝트에 투자했으며, 올해까지 총 3100억원 규모의 ESG 채권을 발행했다. 지속가능발전목표 SDGs 달성에 기여하기 위해 다양한 친환경 활동을 추진 중이다.",0.224
qwen3,3,2160,한국의 첫 달 궤도선 '다누리'가 7월 5일 한국을 떠나 미국 발사장으로 이동한다. 다누리가 성공적으로 달 궤도에 진입하면 한국은 달 탐사에 성공한 7번째 국가가 된다. 특수 컨테이너를 통해 안전하게 수송 중이다.,0.5106382978723405
qwen3,3,2195,"컴투스는 신작 MMORPG '서머너즈워 크로니클'을 8월 16일 국내 출시한다. 이 게임은 기존 IP '서머너즈워'를 기반으로 한 세계관과 다양한 콘텐츠를 갖췄으며, 출시 후 글로벌 시장 진출도 계획 중이다. 사전예약 참여자에게 추가 보상 제공으로 이용자 기대감을 높이고 있다.",0.34188034188034183
qwen3,3,2229,"정부가 유류세 인하 폭을 37%로 확대해 휘발유와 경유 가격이 각각 57원과 38원 인하됐다. 정유사와 자영주유소 모두 가격 인하를 조속히 시행할 방침이다. 또한, 물가 상승과 관련해 6월 소비자물가 상승률이 6%대에 진입할 것으로 예상된다.",0.31884057971014496
qwen3,3,223,"분양시장에서 전용 60㎡ 이하 소형 아파트에 대한 관심이 증가하고 있다. 분양가 상승과 대출규제 강화로 실속을 중시하는 수요가 늘고 있으며, 서울과 지방에서 소형 아파트의 청약 경쟁률이 높아지고 있다. 여러 건설사는 소형 아파트를 중심으로 분양을 확대하고 있다.",0.2573099415204678
qwen3,3,2252,"정부는 주택담보대출 LTV를 80%로 확대하고 만기 50년 정책모기지와 체증식 상환 방식을 도입해 초기 부담을 줄였으나, 총 이자와 상환액은 크게 증가한다. 청년과 신혼부부는 생애주기별 소득과 상환 능력을 고려해 대출 방식을 선택해야 한다.",0.448
qwen3,3,2266,롯데면세점과 클룩 KLOOK이 전략적 협약을 맺고 양사 고객을 위한 혜택을 강화한다. 내국인 고객 대상 여행 패키지와 할인 쿠폰 등을 제공하며 해외점 영업도 재개했다. 이벤트를 통해 5천불 이상 구매 시 도쿄 또는 오사카 여행을 증정한다.,0.4166666666666667
qwen3,3,2270,"임팩티브AI와 데이터히어로는 금융정보 사업 협력을 위한 MOU를 체결하고 AI 금융정보 플랫폼 공동 개발에 나선다. 양사는 데이터히어로의 빅데이터 분석 기술과 임팩티브AI의 AI 기술을 결합해 주가 예측, 기업 탐지 등 핵심 기술을 고도화할 계획이다. 임팩티브AI는 한동대 교수를 대표로 하는 AI 스타트업으로, 최근 5억원 규모의 시드 투자를 유치했다.",0.3657142857142857
qwen3,3,2327,"롯데벤처스가 주최한 엘캠프 9기 데모데이에서 10개 스타트업이 사업 모델을 발표하며 투자와 협업 기회를 얻었다. 행사에는 700여 명이 참석했고, 출신 스타트업들도 전시 부스를 통해 비즈니스 비전을 전달했다. 롯데벤처스는 유망 스타트업을 발굴하고 육성해 사회에 긍정적인 영향을 미치기 위해 지속적으로 노력하고 있다.",0.2772277227722772
qwen3,3,2338,"지마켓과 옥션이 80% 할인 혜택을 제공하는 '쿨 썸머 세일'을 진행한다. 패션, 뷰티, 레저 3개관에서 22개 카테고리 제품을 할인 판매하며, 중복쿠폰과 스마일페이 할인 혜택도 제공한다. 또한, 여행 관련 상품을 중심으로 한 특가 상품과 빅세일 행사도 함께 진행된다.",0.2753623188405797
