model,level,item_id,response,rouge_l
exaone3.5,6,2465,"최동훈 감독의 신작 영화 '외계인 1부' 제작발표회가 열렸으며, KT, SK브로드밴드, LG유플러스가 3천억원을 공동 투자해 국내 미디어 생태계 보호와 콘텐츠 강화를 위한 협약을 체결했다. 이 협약은 IPTV 오리지널 콘텐츠 제작을 통해 국내 콘텐츠 산업의 성장을 지원하고, 독점 콘텐츠로 인한 시청권 제한을 완화하려는 목적을 가지고 있다. 특히, 이들 기업은 최동훈 감독의 영화를 공동으로 수급하며 협업을 시작할 계획이다.",0.27
exaone3.5,6,2467,스튜디오갈릴레이가 국토교통부의 액셀러레이팅 프로그램 'NEXT 챌린지'에 최종 선정되었습니다. 이 스타트업은 스마트시티 분야에서 다수승객 다수차량 배차 최적화 기술을 바탕으로 한 모빌리티 플랫폼으로 인정받았습니다. 선정된 스튜디오갈릴레이는 향후 DRT 서비스 확대를 통해 수도권 및 농어촌 지역의 대중교통 취약 문제 해결에 앞장설 계획입니다.,0.22818791946308725
exaone3.5,6,247,JTBC는 홍정도 부회장의 지시로 예정되었던 18일 디지털 개편 발표를 잠정 보류했습니다. 기자들은 구체적인 디지털 전환 계획 없이 뉴스룸 인력을 줄이는 것에 우려를 표명했습니다. JTBC는 모바일 중심의 원활한 전환을 위해 개편을 서두르지 않고 세밀하게 준비 중이라고 밝혔습니다.,0.2142857142857143
exaone3.5,6,2475,"윤석열 대통령이 서울대 법학전문대학원 송옥렬 교수를 첫 공정거래위원장으로 지명했습니다. 송 교수는 회사법 분야의 권위자로 알려져 있지만, 과거 제자들에 대한 성희롱 발언 논란으로 도덕성 검증이 예상됩니다. 그의 지명은 기업 자율과 규제 완화를 강조하는 정부 정책 방향과 일치하지만, 과거 발언과 검증 부실 논란이 제기되고 있습니다.",0.47058823529411764
exaone3.5,6,2530,"알츠하이머와 파킨슨병 치료제 개발 기업인 디앤디파마텍이 한국거래소의 상장 예비심사에서 또다시 미승인을 받았습니다. 이로 인해 기업가치가 7000억~8000억 원으로 예상되던 디앤디파마텍의 코스닥 상장 계획이 무산되었으며, 이 결정은 향후 바이오 벤처 기업들의 상장에도 부정적인 영향을 미칠 것으로 우려됩니다. 특히 주요 투자자들의 자금 회수에도 어려움이 예상됩니다.",0.22916666666666669
exaone3.5,6,2542,"블룸에너지는 글로벌 연료전지 시장에서 선도적 위치를 차지하며, 특히 고체 산화물 연료전지(SOFC) 기술로 미국과 한국 시장에서 높은 점유율을 보이고 있다. 최근 뉴욕증권거래소에서 주가 상승을 기록하며 투자 매력이 증가했고, SK에코플랜트와의 파트너십을 통해 향후 500MW 이상의 서버 모듈 공급이 예정되어 있어 수익성 개선이 기대된다. 에너지 전환 추세에 따라 블룸에너지의 매출은 지속적으로 성장 중이며, 서버 수요 증가로 인한 추가 성장 가능성도 크다.",0.16326530612244897
exaone3.5,6,2574,"공정거래위원회가 CJ올리브영의 납품업체에 대한 불법 재고 부담 강요 혐의로 서울 본사를 현장 조사했습니다. 이는 납품업체들이 부당 반품과 악성 재고 문제로 공정위에 제소한 결과이며, 제재 수위가 곧 결정될 것으로 예상됩니다. CJ올리브영은 '인앤아웃'이라는 편법을 통해 재고를 납품업체에 떠넘겼다는 혐의를 받고 있습니다.",0.2702702702702703
exaone3.5,6,2595,"전기 및 가스 요금과 전기차 충전료가 인상되었으며, 윤석열 대통령은 귀국 시 이준석 대표와 화기애애한 분위기로 영접했습니다. 주말까지 폭염이 지속되다가 다음 주 초에는 비가 예상되며, 상반기 무역 적자가 역대 최대치를 기록했습니다. 7월부터는 실수요자 중심으로 주택담보대출 규제가 완화될 예정입니다.",0.2878787878787879
exaone3.5,6,2613,CJ대한통운이 한국 공군의 T 50B 전투기 9대를 영국까지 안전하게 운송하는 '블랙이글스 프로젝트'를 성공적으로 완료했습니다. 이 프로젝트는 전투기의 분해 운송부터 무진동 트레일러와 특수 화물 운송 장비를 활용한 정밀한 물류 과정을 포함했습니다. 이번 성공은 국내 항공 기술의 해외 홍보와 방산 수출에 기여할 것으로 기대됩니다.,0.2666666666666666
exaone3.5,6,2628,"무인 항공기 제조 기업인 프리뉴가 수인베스트먼트 등으로부터 30억원 규모의 시리즈A 투자를 유치했다. 이 자금은 드론 종류 다양화와 관련 소프트웨어 개발에 사용될 예정이며, 2025년 기업공개를 목표로 하고 있다. 프리뉴는 현재 VTOL 드론부터 헬리콥터형 드론까지 다양한 모델을 개발 중이며, 인공지능 기반 자율 비행 기술과 클라우드 서비스 플랫폼 구축에도 힘쓰고 있다.",0.2714285714285714
exaone3.5,6,2636,"6월 한국 소비자물가가 1998년 외환위기 이후 처음으로 6%를 기록하며 급등했고, 한국은행은 이에 대응해 기준금리를 사상 최대 폭인 0.5%포인트 인상할 예정이다. 그러나 공급 부족으로 인한 물가 상승에는 금리 인상이 제한적 효과를 보일 수 있으며, 소비 위축으로 인한 경기 침체 우려도 제기된다. 이창용 한은 총재는 효과적인 소통을 강조하며, 잭슨홀 회의에서의 발표를 통해 국제적인 경제 정책 논의에 참여하고 있다.",0.28
exaone3.5,6,2682,"곤충 산업이 탄소 중립 추세 속에서 친환경 원료로 주목받으며, 식용부터 화장품, 의료 분야까지 활용 범위가 확대되고 있습니다. 특히 경북 지역에서 사육 농가가 급증하고 있으며, 매출이 최근 5년간 5배 이상 증가하는 등 미래 신산업으로 성장하고 있습니다. 경상북도는 이 산업을 지원하기 위한 조례를 제정하며 혁신적 발전을 도모하고 있습니다.",0.3311258278145695
exaone3.5,6,2704,"고등학교 졸업 직후 보험설계사였던 A씨와 친구 3명은 여성을 살해해 사망보험금을 타려다 실패하고, 살인 미수와 실족사 위장 계획까지 세운 끝에 각각 징역 1년에서 20년을 선고받았다. 이들은 SNS를 통해 만난 여성과 펜션에서 범행을 시도했으나 실패했으며, 이전에도 다른 피해자를 대상으로 한 계획적인 사기를 모의한 바 있다. 사건은 젊은 나이에도 불구하고 심각한 범죄로 이어진 '나쁜 친구들'의 결과를 보여준다.",0.26484018264840187
exaone3.5,6,278,"CJ대한통운이 영국 국제 에어쇼 참가를 위해 공군 블랙이글스의 T 50B 항공기 9대를 원주에서 영국까지 안전하게 운송하는 '블랙이글스 프로젝트'를 성공적으로 완료했습니다. 이 프로젝트는 항공기 분해, 육로 및 항공 운송, 그리고 최종 목적지까지의 무진동 트레일러 이동을 포함한 복잡한 과정을 거쳤습니다. CJ대한통운은 특수 화물 운송 전문성을 바탕으로 이번 고난도 물류 작업을 수행하며 방산 물류 분야에서의 역량을 입증했습니다.",0.36756756756756753
exaone3.5,6,296,"LG에너지솔루션의 권영수 부회장이 취임 후 첫 유럽 출장을 통해 폴란드의 대규모 배터리 공장과 스마트팩토리 협력사인 지멘스를 방문하며, 스마트팩토리 구축 가속화에 힘쓰고 있다. 이번 방문은 유럽 전기차 시장 수요 대응과 생산 효율성 향상을 위한 핵심적인 점검 활동이다. 또한, LG에너지솔루션은 조직 개편을 통해 스마트팩토리 전환을 더욱 강화하고 글로벌 생산 현장의 표준화를 추진 중이다.",0.2948717948717949
exaone3.5,6,301,"G7 국가들이 러시아산 원유에 대한 가격 상한제 도입에 합의했으며, 미국은 한국의 동참을 요청했습니다. 한국 경제부총리는 구체적 실행 방안을 공유받기로 하며 긍정적인 입장을 보였습니다. 이번 조치는 국제 유가 안정과 러시아의 수익 제한을 목표로 하며, 향후 G20 회의에서 추가 논의될 예정입니다.",0.2603550295857988
exaone3.5,6,315,"하반기 쏘카, 현대오일뱅크, 케이뱅크 등 대형 기업들의 IPO가 진행되면서 공모주 시장 활성화가 기대되나, 상반기의 경기 불황과 유동성 악화로 인한 상장 철회 사례를 감안해야 합니다. 쏘카는 성장성을 강조한 EV/Sales 지표를 사용했고, 현대오일뱅크와 케이뱅크는 각각 정유업 호황과 가상자산 연계 성장성을 바탕으로 높은 기업 가치를 목표로 합니다. 그러나 대형 IPO가 진행될 경우 시중 유동성 집중으로 인한 시장 불균형 가능성도 우려됩니다.",0.21153846153846156
exaone3.5,6,326,"경기 고양시 후곡마을의 4개 단지가 통합 재건축을 추진하며, 이는 사업성 향상과 절차 간소화를 기대하기 때문입니다. 새 정부의 재건축 규제 완화 기조가 이러한 움직임을 촉진하고 있으며, 수도권 여러 지역에서 비슷한 통합 재건축 계획이 증가하고 있습니다. 그러나 대규모 단지는 협상력 강화에도 불구하고 관리 복잡성 증가 등의 단점이 동반될 수 있습니다.",0.24852071005917162
exaone3.5,6,330,"피플펀드는 임직원의 일탈로 인한 투자자 손실을 방지하기 위해 아파트담보투자 상품에 세이프가드 프로그램을 도입했습니다. 이 프로그램은 제3 금융기관 관리, 보험 가입 등 기존 안전장치에 근저당권 보호 서비스와 담보 권리 변경 알람 서비스를 추가하여 투자 안전성을 강화했습니다. 또한, 이 프로그램 출시를 기념해 수수료 면제 이벤트를 진행하며 추가 금리 혜택을 제공하고 있습니다.",0.3116883116883116
exaone3.5,6,353,"환경부와 한국수자원공사가 주최하는 '2022 Startup Water' 공모전은 물산업 혁신 아이디어와 사업화 아이디어를 공모하며, 대학생과 스타트업을 대상으로 진행된다. 이번 대회는 우수 아이디어 9개 팀에게 총 1700만원의 상금을, 사업화 부문에서는 9개 팀에게 최대 2500만원을 지원하며, 글로벌 진출 기회도 제공한다. 목표는 혁신 창업기업의 성장 지원을 통해 국내 물산업 생태계를 활성화하는 것이다.",0.24644549763033177
exaone3.5,6,390,"국내 정유사들의 올해 1~5월 석유제품 수출액이 고유가 영향으로 지난해 대비 2배 이상 증가하여 242억6500만 달러를 기록했다. 특히 5월 수출액은 역대 최고치인 61억4700만 달러를 달성했으며, 이는 수출단가 상승과 정유사들의 가동률 증가 때문이다. 그러나 국내 휘발유 및 경유 가격은 여전히 상승 중이지만, 유류세 인하로 인해 향후 가격 내림세가 예상된다.",0.4417177914110429
exaone3.5,6,428,"티웨이항공은 대구광역시와 협약을 통해 본사를 대구로 이전하며, 대구·경북 통합 신공항의 성장을 위해 협력하기로 했습니다. 협약 내용에는 지역 일자리 창출, 적극적인 노선 개설, MRO 사업 확대 등이 포함되어 있습니다. 티웨이항공은 향후 구체적인 이전 계획을 논의하며, 대구 지역 운항 노선을 점차 확대할 예정입니다.",0.3282051282051282
exaone3.5,6,482,"휠라코리아는 제주유나이티드의 탄소중립 축구 경기에 리사이클 유니폼 '해녀 삼춘'을 제공하며, 폐플라스틱을 재활용한 친환경 소재를 사용했습니다. 경기장 내 휠라 존에서는 지속가능 제품들을 전시하고, 대중교통 이용 팬들에게 친환경 상품을 증정하는 이벤트를 진행했습니다. 휠라는 이러한 활동을 통해 지속가능한 환경 보호 노력을 지속할 계획입니다.",0.25503355704697983
exaone3.5,6,494,"5월 음식서비스 온라인 거래액이 전년 대비 3.7% 감소한 반면, 여행 및 문화 레저 분야는 코로나 이전 수준을 넘어섰다. 이는 사회적 거리두기 해제 후 외부 활동 증가로 인한 결과로 해석된다. 전체 온라인 쇼핑 거래액은 전년 대비 10.5% 증가하며 17조 원을 돌파했다.",0.2482758620689655
exaone3.5,6,503,"에코백스가 최신 AI 기술을 적용한 로봇청소기 디봇 T10 패밀리 시리즈를 출시했습니다. 이 제품은 장애물 인식 정확도 향상, 강화된 물걸레 청소 기능, 그리고 대화형 AI 비서 이코를 탑재하여 사용자 경험을 개선했습니다. 가격은 디봇 T10 플러스가 94만 9천원, 디봇 T10 터보가 1백 9만 9천원으로, 안전성과 개인정보 보호 인증을 받았습니다.",0.25999999999999995
exaone3.5,6,589,"올해 5월까지 가상자산을 이용한 불법 외환거래 적발 금액이 1조5231억 원으로, 전체 외환 범죄의 78.1%를 차지하며 작년 대비 약 2배 증가했습니다. 특히 '김치 프리미엄'을 이용한 환치기 범죄가 급증하면서, 투기 세력에 대한 규제 제도화 필요성이 제기되고 있습니다. 국회 의원실은 이러한 추세를 고려해 가상자산 관련 외환 범죄를 효과적으로 관리하기 위한 법적 장치 마련을 촉구하고 있습니다.",0.3261802575107296
exaone3.5,6,607,"중소기업중앙회의 조사에 따르면, 하반기 경기 전망지수가 전년 대비 하락하며 중소기업들은 원자재 가격 상승, 내수 부진 등을 주요 어려움으로 지목했습니다. 업종별로는 제조업과 서비스업 간 전망이 상반되며, 경영 회복 시점은 2024년 이후로 예상되었습니다. 중소기업들은 세금 감면과 인력난 해소 등을 가장 필요한 정책으로 요청했습니다.",0.24390243902439024
exaone3.5,6,642,"GS25가 12일부터 전국 1만6000여 개 점포에서 원소주 스피릿을 주 3회 최대 4병씩 판매 시작합니다. 이 제품은 가수 박재범의 원스피리츠에서 출시한 증류식 소주로, 깔끔하고 부드러운 맛이 특징입니다. GS리테일은 홍보를 위해 점포 출입문에 포스터를 부착하고, GS더프레시에서도 판매를 확대할 예정입니다.",0.345679012345679
exaone3.5,6,664,"500대 기업 중 28곳이 하반기 투자 규모를 상반기보다 줄일 계획이며, 주요 이유로는 경제 불안정과 자금 조달 어려움이 지목되었다. 고물가와 글로벌 경제 긴축 등이 주요 위험 요소로 꼽혔다. 그러나 정부의 지원 정책으로 하반기 투자 심리 개선이 기대된다.",0.2828282828282828
exaone3.5,6,677,"삼성전자가 2022년형 Neo QLED 8K 스마트 TV와 모니터를 통해 업계 최초로 엑스박스 게임 패스를 포함한 여러 스트리밍 게임 서비스를 지원하는 '삼성 게이밍 허브'를 출시했다. 이 서비스로 사용자는 별도 게임기 없이도 100여 개의 클라우드 게임을 즐길 수 있으며, 유튜브, 트위치 등 다양한 콘텐츠도 함께 이용 가능하다. 삼성전자는 이 기술로 향상된 게임 경험을 제공하며, 파트너십을 확대해 나갈 계획이다.",0.2948717948717949
exaone3.5,6,681,"지난달 소비자물가 상승률이 24년 만에 최고치인 6%를 기록하며 급등했습니다. 이는 IMF 위기 이후 가장 높은 수준으로, 특히 외식 물가가 1992년 이후 최고치를 보였습니다. 소비자들은 최저가 마트를 찾고 제철 식자재 위주로 구매하며 물가 상승에 대응하고 있지만, 여전히 높은 물가로 인해 구매 패턴이 변화하고 있습니다. 전문가들은 앞으로의 요금 인상과 환율 변동으로 인해 물가 상승률이 8%까지 치솟을 수 있다고 우려하고 있습니다.",0.3113207547169812
exaone3.5,6,689,"기획재정부와 통계청은 국제 에너지 및 농산물 가격 상승으로 인해 소비자 물가가 6% 상승하며, 이 추세가 지속될 것으로 전망했습니다. 특히 농축수산물과 석유류 가격 상승이 물가 상승에 큰 영향을 미치고 있으며, 근원 물가 품목의 상승 압력도 확대되고 있습니다. 정부는 민생 안정을 위해 추가적인 대책을 마련하고 있으며, 향후 물가 상승률이 7~8%까지 오를 가능성도 배제하지 않고 있습니다.",0.20105820105820107
exaone3.5,6,702,"한라와 KD가 부산시 해운대구 우동에 해운대 한라비발디 펜트빌 오피스텔을 이달 분양 예정이다. 지하 5층, 지상 35층 규모의 120실 규모로, 아파트와 유사한 구조를 갖추고 있으며, 우수한 교통과 생활 인프라를 자랑한다. 인근 개발 계획과 교통 확충으로 미래 가치가 높게 평가되고 있다.",0.33128834355828224
exaone3.5,6,715,"원희룡 국토교통부 장관은 국토부 산하 28개 공공기관의 혁신 방안에 근본적인 문제의식 부족을 지적하며, 민간 전문가와 함께 민관TF를 구성해 개혁을 강화할 계획임을 밝혔다. 현재 제출된 방안들이 주로 경영 효율화에 치중되어 있어, 공정성과 투명성 부족 문제를 해결하기 위한 엄격한 검토가 필요하다고 강조했다. 또한, 불공정 행위와 유착 고리를 끊기 위해 8월까지 구체적인 조치를 마련하고, 성과에 따른 인센티브와 페널티 제도를 도입할 예정이다.",0.22099447513812157
exaone3.5,6,755,고승범 금융위원장이 짧은 재임 기간 동안 가계부채 증가율을 크게 낮추는 등 금융 안정에 주력한 후 이임식을 가졌습니다. 그는 코로나19 상황 속에서 부채 관리와 유동성 문제 해결에 힘썼다고 평가했습니다. 윤석열 대통령은 김주현 후보자에 대한 청문보고서를 신속히 제출해달라고 요청했습니다.,0.23255813953488375
exaone3.5,6,82,"미국에서 마약성 진통제인 오피오이드 과다 복용으로 인한 사망자 수가 10만 명을 넘어섰으며, 이 문제는 제약회사의 마케팅 전략과 정부의 부실한 규제로 인해 심각해졌다. HBO 다큐멘터리 ""세기의 범죄""는 이 중독 사태의 배경과 제약 산업의 역할을 폭로하며, 현재까지도 이 문제 해결을 위한 노력이 진행 중이다. 웨이브에서 이 다큐멘터리를 통해 관련 이슈를 확인할 수 있다.",0.3105022831050228
exaone3.5,6,826,"기초과학연구원 IBS는 대전 본원에 '생명과학 연구클러스터'를 출범시키며 이창준 인지 및 사회성 연구단장을 연구소장으로 임명했습니다. 이 클러스터는 인지 및 사회성, 유전체 교정, 바이오 분자 및 세포구조 연구단으로 구성되어 연구 간 시너지 창출을 목표로 합니다. IBS는 이러한 클러스터 체제를 통해 연구 경쟁력을 강화하고 국가 전략 연구 분야를 육성할 계획입니다.",0.42666666666666675
exaone3.5,6,838,"올해 재산세 고지서에서 1주택자는 재산세가 크게 감소했지만, 2주택 이상 다주택자는 공시가격 상승으로 인해 세금 부담이 증가했다. 이로 인해 고가의 주택 한 채를 소유한 1주택자와 여러 채를 소유한 다주택자 간 재산세 격차가 커져 불만이 제기되고 있다. 부동산 전문가들은 주택 수보다 주택 가치를 기준으로 세금을 부과하는 세제 개편이 필요하다고 주장하고 있다.",0.2571428571428571
exaone3.5,6,86,"아카마이의 톰 레이턴 CEO는 전통적인 해킹 위협, 특히 랜섬웨어가 급증하고 있다고 밝혔습니다. 아카마이는 24시간 실시간 탐지 기능을 갖춘 마이크로세그멘테이션 보안 솔루션으로 이러한 위협에 대응하며, 클라우드 보안 분야에서도 빠른 성장을 보이고 있습니다. 레이턴 CEO는 사이버 복원력 강화를 위해 클라우드 환경 전반의 보안 강화가 필수적이라고 강조했습니다.",0.3292682926829269
exaone3.5,6,866,"이창양 산업통상자원부 장관은 반도체 종합대책 발표와 함께 반도체 연관 산업 육성 전략을 강조했습니다. 반도체를 중심으로 배터리, 디스플레이, AI 로봇 등을 연계한 '반도체 플러스 산업'을 통해 경제적 파급 효과를 확대하려는 계획입니다. 또한, 글로벌 인플레이션과 에너지 위기 극복을 위해 수출 경쟁력 강화와 원전 활용을 강조하며, 규제 개혁과 세액공제를 통한 기업 투자 촉진을 추진할 방침입니다.",0.294478527607362
exaone3.5,6,872,"한국 경제가 3분기 마이너스 성장률을 기록하며 경기후퇴 위험에 직면했으며, 노무라 연구소는 한국을 포함한 여러 국가들이 내년 내 경기후퇴를 겪을 것으로 전망했다. 특히 한국의 경우 기준금리 인상으로 인한 주택시장 불안정이 경기 악화를 가속화할 수 있다고 경고했다. 글로벌 투자자들은 아시아 증시에서 대규모 자금을 철수시켜 경제 불확실성을 반영하고 있다.",0.18884120171673818
exaone3.5,6,902,"신한저축은행은 '제16회 국가지속가능경영 대상'에서 기업윤리 부문 공정거래위원회 위원장상을 수상했습니다. 이는 신한저축은행의 포용적 금융 실천, 강력한 컴플라이언스 시스템 구축, 그리고 개인정보 보호 강화 노력을 인정받은 결과입니다. 이희수 사장은 수상을 통해 윤리경영과 사회적 책임을 강조했습니다.",0.2933333333333334
exaone3.5,6,915,"탈잉의 2분기 인기 검색어 1위는 '댄스'로, 전년 동기 대비 지속적인 인기를 보였다. '퍼스널 컬러'는 검색량이 218% 증가하며 2위를 기록했으며, 이는 일상 회복과 함께 개성 표현에 대한 관심 증가 때문으로 보인다. 톱 10 검색어에는 취미 활동부터 직무 역량, 부동산 투자까지 다양한 트렌드가 반영되었다.",0.2435897435897436
exaone3.5,6,97,"나이벡의 주가가 상승 중이며, 펩타이드 기반 조직재생 바이오 소재가 하반기 임상 진입을 앞두고 있다. 이 연구는 범부처 전주기 의료기기 연구개발 사업단의 지원을 받아 진행 중이며, 정부 출연금과 글로벌 판매처의 구매 의사 확인으로 상용화에 긍정적 전망이 제기되고 있다.",0.28358208955223885
exaone3.5,6,101,"bhc치킨의 '해바라기 봉사단'은 상반기 동안 12회의 봉사활동을 통해 다양한 사회공헌 프로젝트를 진행했으며, 대학생 자원봉사단체로서 MZ세대의 사회적 가치 참여를 이끌고 있다.  사회적 거리두기 완화 후에는 대면 봉사활동을 확대하여 취약계층 지원, 환경정화 등에 힘썼다. bhc치킨은 본사와 가맹점이 함께 참여하는 BSR 프로그램을 통해 지속적인 사회공헌 활동을 확대할 계획이다.",0.2833333333333333
exaone3.5,6,1044,"금융감독원 직원들의 평균 평가 상여금이 전년 대비 94만원 증가하여 643만원으로 4년 만에 600만원대에 재진입했다. 금감원의 경영 평가 결과는 외부에 공개되지 않아 개선 방안 마련에 어려움이 제기되고 있다. 올해 금감원 업무 만족도는 86.6점으로 상승했으나, 민원 및 분쟁 조정 분야는 여전히 낮은 점수를 받았다. 윤창현 의원은 이복현 원장에게 금감원의 역할 강화와 혁신을 촉구했다.",0.24193548387096775
exaone3.5,6,1054,"손태승 우리금융회장이 자사주 5000주를 장내 매입하여 총 11만8127주를 보유하게 되었다. 이는 주가 저평가 시기에 기업 가치 제고 의지를 보여주는 세 번째 자사주 매입이다. 최근 미주 지역 IR 활동을 통해 해외 투자자들의 긍정적 반응을 얻으며, 우리금융그룹의 글로벌 투자 관심이 증가하고 있다.",0.4727272727272727
exaone3.5,6,1064,"테슬라의 비트코인 평가액이 3개월 만에 약 5700억원의 손실을 기록하며 1조6340억원에서 1조630억원으로 급락했다. 이는 글로벌 긴축 기조로 인한 비트코인 가격 폭락 때문이다. 테슬라의 경우 비트코인을 상품 결제 수단으로 도입하려 했으나 CEO의 환경 문제 우려로 인해 계획이 지연되었으며, 현재 비트코인 손실은 회계상으로 직접적인 수익 악화로 반영되지 않는다.",0.29447852760736193
exaone3.5,6,1096,"전진바이오팜은 포파코와 10억원 규모의 반려동물 사료 및 용품 공급계약을 체결했으며, 네이처플랜이 공동으로 개발한 프리미엄 사료 브랜드 '페디칼'이 출시되었다. 이 제품은 반려견과 반려묘를 위한 기능성 사료 6종으로 구성되어 관절, 피부, 눈 건강 등 다양한 영양 성분을 제공한다. 특히 치아씨드 추출물과 높은 오메가3 함량, 유기농 식물성 단백질, HACCP 인증을 통해 안전성을 확보했다.",0.3314917127071823
