model,level,item_id,response,rouge_l
exaone3.5,3,607,"중소기업중앙회의 조사에 따르면, 하반기 경기 전망지수가 전년 대비 하락하며 중소기업들은 원자재 가격 상승, 내수 부진 등을 주요 어려움으로 지목했습니다. 업종별로는 제조업과 서비스업 간에 호전과 부진이 혼재되었으며, 경영 회복 시점은 2024년 이후로 예상되었습니다. 중소기업들은 세금 감면과 인력난 해소 등을 가장 필요한 정책으로 요청했습니다.",0.24999999999999994
exaone3.5,3,642,"GS25가 12일부터 전국 1만6000여 개 점포에서 가수 박재범의 주류 브랜드 원소주 스피릿을 출시한다. 이 제품은 증류식 소주로 깔끔하고 부드러운 맛을 강조하며, 매주 화요일, 목요일, 토요일에 하루 최대 4병까지 판매된다. GS리테일은 편의점뿐 아니라 슈퍼마켓 GS더프레시에서도 판매를 확대할 예정이다.",0.3670886075949367
exaone3.5,3,664,"500대 기업 중 28곳이 하반기 투자 규모를 상반기보다 줄일 계획이며, 이는 국내외 경제 불안정과 자금 조달 어려움 때문으로 분석된다. 주요 위험 요소로는 고물가, 글로벌 긴축 정책, 우크라이나 사태로 인한 공급망 문제 등이 지목되었다. 전경련은 정부의 경제 개선 정책으로 하반기 기업 투자 심리가 회복될 것으로 전망했다.",0.3518518518518518
exaone3.5,3,677,"삼성전자가 2022년형 Neo QLED 8K 스마트 TV와 모니터를 통해 업계 최초로 엑스박스 게임 패스를 포함한 여러 스트리밍 게임 서비스를 지원하는 '삼성 게이밍 허브'를 출시했다. 이 서비스로 사용자는 별도 게임기 없이도 100여 개의 클라우드 게임을 즐길 수 있으며, 유튜브, 트위치 등 다양한 콘텐츠도 함께 이용 가능하다. 삼성전자는 이 기술로 향상된 게임 경험을 제공하며, 파트너십 확장과 사용자 맞춤형 서비스 개발을 통해 게임 경험을 더욱 향상시킬 계획이다.",0.2754491017964072
exaone3.5,3,681,"지난달 소비자물가 상승률이 24년 만에 최고치인 6%를 기록하며, 특히 외식 물가는 1992년 이후 최고 수준에 도달했습니다. 소비자들은 최저가 마트를 찾아 저렴한 제철 식자재 위주로 구매하려 하지만, 여전히 물가 상승으로 인해 장바구니 부담이 커지고 있습니다. 전문가들은 전기와 가스 요금 인상 및 환율 상승으로 인해 향후 물가 상승률이 8%까지 치솟을 수 있다고 우려하고 있습니다.",0.34196891191709844
exaone3.5,3,689,"기획재정부와 통계청은 국제 에너지 및 곡물 가격 상승으로 인해 소비자물가가 6% 상승하며, 이는 IMF 위기 이후 23년 만에 기록된 수준이라고 밝혔다. 특히 농축수산물과 석유류 가격 상승이 물가 상승에 크게 기여하고 있으며, 근원 품목의 물가 상승 압력도 확대되고 있다. 정부는 이러한 상황을 고려해 생활물가 안정화와 서민 지원을 위한 추가 대책을 지속적으로 마련할 계획이다. 향후 물가 상승률이 7~8%까지 치솟을 가능성도 제기되었다.",0.23414634146341465
exaone3.5,3,702,"한라와 KD가 이달 중 부산시 해운대구 우동에 해운대 한라비발디 펜트빌(120실, 전용면적 105m2) 오피스텔을 분양한다. 이 지역은 하이엔드 주거 타운으로 발전 중이며, 우수한 교통 인프라와 개발 계획으로 미래 가치가 높게 평가된다. 주변에는 해운대 해수욕장, 송림공원 등 쾌적한 자연환경과 다양한 생활 인프라가 갖춰져 있어 투자자와 거주자들에게 매력적이다.",0.19565217391304346
exaone3.5,3,715,"원희룡 국토교통부 장관은 국토부 산하 28개 공공기관의 혁신 방안에 근본적인 문제의식 부족을 지적하며, 민간 전문가와 함께 민관TF를 구성해 개혁을 강화할 계획임을 밝혔다. 현재 제출된 방안들이 주로 경영 효율화에 초점을 맞추고 있지만, 공정성과 투명성 부족이 지적되었다. 장관은 불공정 행위와 유착 고리 해소를 위해 8월까지 구체적인 조치를 마련하고, 성과에 따른 인센티브와 페널티 제도를 도입할 예정이다.",0.22754491017964074
exaone3.5,3,755,"고승범 금융위원장은 짧은 재임 기간 동안 가계부채 증가율을 크게 낮추는 데 주력했으며, 이는 그의 주요 성과로 꼽았다. 코로나19 상황 속에서 금융 안정을 위해 부채 관리와 유동성 문제 해결에 힘썼다고 밝혔다. 사의 표명 후 두 달 만에 이임식을 열었으며, 윤석열 대통령은 김주현 후보자에 대한 청문보고서 송부를 재요청했다.",0.22580645161290322
exaone3.5,3,82,"미국에서 마약성 진통제 오피오이드 과다 복용으로 인한 사망자 수가 10만 명을 넘어서며 심각한 공중보건 위기가 발생했으며, 이 문제는 제약회사, 의사, 정부의 역할이 복합적으로 작용한 결과로 드러났다. HBO 다큐멘터리 '세기의 범죄'는 제약 산업의 부정 행위와 오피오이드 중독의 원인을 실제 인물들의 증언을 통해 조명하고 있다. 이 다큐멘터리는 웨이브에서 공개되어 오피오이드 위기의 진실을 공개하고 있다.",0.3243243243243243
exaone3.5,3,826,"기초과학연구원 IBS는 대전 본원에 '생명과학 연구클러스터'를 출범시키며 이창준 인지 및 사회성 연구단장을 연구소장으로 임명했다. 이 클러스터는 인지 및 사회성, 유전체 교정, 바이오 분자 및 세포구조 연구단으로 구성되어 연구단 간 협력을 강화한다. IBS는 이러한 클러스터 체제를 통해 연구 시너지를 창출하고 국가 전략 연구 분야의 경쟁력을 높이는 것을 목표로 한다.",0.4210526315789474
exaone3.5,3,838,"올해 재산세 고지서에서 1주택자는 재산세가 크게 감소했으나, 2주택 이상 다주택자는 공시가격 상승으로 인해 세금 부담이 증가했다. 고가의 주택을 소유한 1주택자는 특히 세금 인하 효과를 크게 누려 상대적 박탈감을 느끼는 반면, 다주택자는 세액 상승으로 어려움을 겪고 있다. 이에 따라 주택 수 대신 가액 기준으로 세금을 부과하는 세제 개편 필요성이 제기되고 있다.",0.3285024154589372
exaone3.5,3,86,"아카마이의 톰 레이턴 CEO는 전통적인 해킹 위협, 특히 랜섬웨어가 급증하고 있다고 경고하며, 이에 대응하기 위해 24시간 실시간 탐지 시스템과 마이크로세그멘테이션 보안 솔루션의 중요성을 강조했다. 클라우드 보안이 특히 중요해졌으며, 다양한 접근 층위에서의 복합적인 보안 전략이 필요하다고 조언했다. 아카마이는 보안 분야에서 빠른 성장세를 보이며, 올해 보안 및 컴퓨팅 매출이 CDN 매출을 초과할 것으로 예상된다.",0.30851063829787234
exaone3.5,3,866,"이창양 산업통상자원부 장관은 반도체 종합대책을 이달 중 발표하며, 반도체와 연계 산업 육성을 통해 경제 전반의 효과를 확대할 계획을 밝혔다. 글로벌 인플레이션과 에너지 위기 극복을 위해 수출 경쟁력 강화와 원전 활용을 강조했다. 또한, 생산성 향상을 위한 기업 설비투자 세액공제와 함께 화학물질 규제 개혁을 추진할 예정이다.",0.31999999999999995
exaone3.5,3,872,"한국 경제는 3분기 마이너스 성장률을 기록하며 경기후퇴 위험에 직면했으며, 노무라 연구소는 한국을 포함한 여러 국가들이 내년 내 경기후퇴를 겪을 것으로 전망했다. 특히 한국의 경우 기준금리 인상으로 인한 주택시장 붕괴가 경기 악화를 가속화할 수 있다고 경고했다. 글로벌 경제 둔화로 인해 수출 의존 성장 모델이 한계에 도달하면서, 아시아 주요 증시에서도 대규모 자본 이탈이 발생하고 있다.",0.19917012448132781
exaone3.5,3,902,"신한저축은행은 '제16회 국가지속가능경영 대상'에서 기업윤리 부문 공정거래위원회 위원장상을 수상했다. 이는 신한저축은행이 포용적 금융 실천과 강력한 컴플라이언스 시스템 구축, 지속적인 윤리 교육 등을 통해 우수한 지속가능경영을 인정받은 결과이다. 이희수 신한저축은행장은 수상을 통해 윤리경영과 고객 중심의 지속가능한 성장을 약속했다.",0.3057851239669422
exaone3.5,3,915,"탈잉의 2분기 인기 검색어 1위는 '댄스'로, 전년 동기 대비 지속적인 인기를 보였다. '퍼스널 컬러'는 검색량이 218% 증가하며 2위를 기록했으며, 이는 일상 회복과 함께 개성 표현에 대한 관심 증가를 반영한다. 톱 10 검색어에는 취미 활동, 자기계발, 그리고 하반기 부동산 투자에 대한 관심까지 다양한 트렌드가 반영되었다.",0.2222222222222222
exaone3.5,3,97,"나이벡의 주가가 상승 중이며, 이는 펩타이드 기반 조직재생 바이오 소재의 하반기 임상 진입 계획 발표 때문이다. 이 연구는 범부처 전주기 의료기기 연구개발 사업단의 지원을 받아 서울대 치과병원과 한국광기술연구원과 협력하여 진행 중이며, 정부 출연금 50억원을 지원받았다. 나이벡은 임상 진입 성공으로 빠른 상용화를 목표로 하며, 이미 글로벌 판매처로부터 구매 의사를 확인받았다고 밝혔다.",0.21951219512195122
exaone3.5,3,101,"bhc의 '해바라기 봉사단'은 상반기에 12회 봉사활동을 펼치며 다양한 사회공헌 프로젝트를 진행했고, 특히 대면 활동을 확대했습니다. 대학생 자원봉사단체인 이들은 컬러링북 제작부터 환경정화, 취약계층 지원까지 폭넓게 참여했습니다. bhc치킨은 가맹점들과 함께 치킨 기부 릴레이를 실시하고, 산불 피해 지역 소방대원들에게 치킨을 후원하는 등 사회적 가치 창출에 힘쓰고 있으며, 하반기에도 이러한 활동을 지속 확대할 계획입니다.",0.253968253968254
exaone3.5,3,1044,"금융감독원 직원들의 평균 평가 상여금이 전년 대비 94만원 증가하여 643만원으로 4년 만에 600만원대에 재진입했으며, 지급 인원은 역대 최대인 1천532명으로 늘었다. 그러나 금감원의 경영 평가 세부 내용은 공개되지 않아 개선 방안 마련에 어려움이 제기되고 있다. 올해 금감원 업무 만족도는 86.6점으로 상승했으나, 민원 및 분쟁 조정 분야는 여전히 낮은 점수를 받았다. 윤창현 의원은 신임 금감원장에게 변화와 혁신을 강조했다.",0.23754789272030652
exaone3.5,3,1054,"손태승 우리금융회장이 자사주 5000주를 장내 매입하여 총 11만8127주를 보유하게 되었으며, 이는 주가 저평가 시기에 기업 가치 제고 의지를 보여주는 세 번째 자사주 매입이다. 최근 미주 지역에서의 해외 IR 활동으로 투자자들의 긍정적 반응을 얻으며, 해외 투자자들의 관심이 증가하고 있다. 우리금융그룹은 이러한 흐름을 바탕으로 국내외 투자자 기반 확대에 주력할 계획이다.",0.41935483870967744
exaone3.5,3,1064,"테슬라의 비트코인 평가액이 3개월 만에 약 5700억원의 손실을 기록하며 8억2000만 달러로 급락했다. 이는 비트코인 가격 폭락으로 인한 것이며, 지난해 10월 10억 달러의 차익을 기록했던 것과 대조적이다. 테슬라의 경우 비트코인을 상품 결제 수단으로 도입하려 했으나 CEO의 탄소 배출 우려로 인해 계획이 지연되었다. 미국의 다른 기업 마이크로스트래티지도 비슷한 규모의 손실을 본 것으로 알려졌다.",0.2298850574712644
exaone3.5,3,1096,"전진바이오팜과 포파코는 10억원 규모의 반려동물 사료 및 용품 공급계약을 체결했으며, 네이처플랜이 공동으로 개발한 프리미엄 사료 브랜드 '페디칼'이 출시되었다. 이 사료는 관절건강, 피부/모질 개선 등 기능성 성분을 함유하고 유기농 재료로 만들어져 온라인과 폴리파크 매장에서 판매된다. 제품은 HACCP 인증을 받아 위생적으로 관리된다.",0.3132530120481927
exaone3.5,3,1112,"한덕수 국무총리는 5일 팜 민 찐 베트남 총리와 통화를 통해 양국 간 경제협력 강화와 2030 부산 세계박람회 협력 등을 논의했다. 특히, 수교 30주년을 맞아 양국 관계를 전략적 동반자 관계로 발전시키고 교역규모를 1천억 달러로 확대하기로 합의했다. 양측은 한국 금융기관의 베트남 진출 지원과 함께 향후 양국 정상 간 방문을 통해 협력을 더욱 강화하기로 했다.",0.26993865030674846
exaone3.5,3,1124,"올해 상반기 서울, 경기, 인천의 아파트 청약 경쟁률과 최저 당첨 가점이 지난해 대비 크게 하락했으며, 특히 서울은 경쟁률이 작년의 4분의 1 수준으로 떨어졌다. 대구는 당첨 최저 가점이 0점을 기록하며 청약 열기가 가장 저조했다. 전문가는 분양가 상승으로 인해 고가 주택보다는 입지나 가격이 유리한 주택에 대한 수요가 증가할 것으로 전망했다.",0.3285024154589372
exaone3.5,3,1137,"바이오니아는 범부처전주기 의료기기 연구개발사업단 과제에 선정되어 HIV와 B형, C형 간염 진단 시약의 유럽 체외진단 의료기기 인증을 추진하며, 이로써 유럽 임상 비용 절감과 국내 기업의 국제 임상 기회 확대에 기여할 예정이다. 이번 과제는 총 37억5000만원 규모로, 개정된 유럽 인증 기준에 맞춰 상온 보관 가능한 진단키트를 개발하여 ExiStation FA 96 384 시스템에 적용할 계획이다. 바이오니아는 이를 통해 2025년까지 약 6억 달러의 매출을 목표로 유럽 시장 진출을 가속화할 방침이다.",0.2962962962962963
exaone3.5,3,1151,"올 여름 폭염으로 인해 전력 수요가 급증하여 예비율이 10% 이하로 떨어지며 전력 공급이 빠듯한 상황입니다. 특히 8월에는 전력 예비력이 비상경보 기준까지 떨어질 가능성이 있어, 정부는 신규 설비 활용과 수요 관리로 전력난을 완화하려 합니다. 미용실 등에서는 냉방 강화로 전력 소비가 증가하여 전력 부족 우려가 커지고 있습니다.",0.28426395939086296
exaone3.5,3,1174,"정부는 정보통신공사업법 시행령을 개정하여 대기업 공사업자 기준을 명확히 하고, 도급 금액 하한을 10억원으로 설정했다. 무자격자의 부적절한 광고 시 과태료를 부과하며, 정보통신공사업의 시장 질서 확립과 중소업체 보호를 목표로 한다. 이 개정안은 12일부터 시행될 예정이다.",0.29931972789115646
exaone3.5,3,1181,"보험사들은 미니보험의 낮은 수익성으로 인해 디지털 보험사 설립에 소극적이다. 최근 금융당국이 미니보험 설립 요건을 완화했으나, 인적 및 물적 요건과 높은 운영 부담으로 인해 진입 장벽은 여전히 높다. 기존 미니보험 업체들도 수익성 문제로 어려움을 겪고 있어, 보험사들은 당장 디지털 보험사 설립 계획이 없다고 밝혔다.",0.29629629629629634
exaone3.5,3,1309,"한국생명공학연구원과 원광대학교병원이 바이오의약 분야 발전을 위한 업무협약을 체결했다. 협약을 통해 양 기관은 연구 역량 강화, 교육 경쟁력 향상, 연구 장비 공동 활용 등을 통해 긴밀하게 협력할 계획이다. 김장성 원장과 서일영 병원장은 이 협력이 국가 바이오 R&D 혁신의 모범 사례가 되기를 기대했다.",0.3458646616541353
exaone3.5,3,1317,"현대제철은 2022년 ESG 중심의 디지털 통합 보고서 '비욘드 스틸'을 발간하여 환경, 사회, 지배구조 분야의 지속 가능 경영 전략과 성과를 공개했다. 보고서는 탄소 중립 목표, 친환경 설비 투자, 안전 문화 강화 등 다양한 ESG 활동을 상세히 담고 있으며, 디지털화를 통해 탄소 배출량 감축에도 기여하고 있다. 현대제철은 이러한 노력을 통해 지속 가능한 성장을 위한 ESG 경영의 중요성을 강조하고 있다.",0.29323308270676685
exaone3.5,3,1318,"유럽연합(EU)은 미국의 OFAC와 유사한 외국 제재 전담 기구 설립을 검토 중이다. EU 금융담당 집행위원은 이 기구가 회원국의 제재 이행을 돕고 유럽의 감독 체계를 강화할 것이라고 밝혔다. 현재 EU는 모든 회원국의 승인을 필요로 하지만, 제재 이행 수준은 국가마다 차이가 있다.",0.3225806451612903
exaone3.5,3,139,CJ ENM과 SK텔레콤이 최첨단 버추얼 프로덕션 스튜디오를 구축하며 마이크로LED와 확장현실(XR) 기술을 활용한 콘텐츠 제작 혁신을 선도하고 있다. CJ ENM의 '씨제이이앤엠 스튜디오 센터'는 대형 마이크로LED 벽을 갖춘 실내 스튜디오와 야외 세트를 통해 실제 장소 방문 없이 다양한 배경을 구현한다. SK텔레콤의 '팀 스튜디오'는 실시간 협업 기능을 통해 국내외 스튜디오 간의 원격 촬영을 가능하게 함으로써 제작 효율성을 극대화한다. 이러한 기술 도입은 콘텐츠 제작의 시공간 제약을 극복하고 비용과 시간을 절감할 것으로 기대된다.,0.20080321285140565
exaone3.5,3,1410,"정부는 기획재정부 주도로 첫 범부처 플랫폼 정책협의체를 개최하여 역동적이고 혁신적인 플랫폼 생태계 구축 방안을 논의했다. 회의 참석자들은 민간 자율규제의 중요성을 강조하며, 전기통신사업법 개정 등을 통해 자율규제의 법적 기반을 마련하기로 했다. 향후 정부는 민간 자율기구를 통해 플랫폼별 특성에 맞는 규제 방안을 마련하고, 부처 간 협력을 강화하여 플랫폼 시장의 건전한 성장을 지원할 계획이다.",0.29743589743589743
exaone3.5,3,1424,"루닛은 일본 시장 진출 6개월 만에 도입 병원 100곳을 돌파하며 빠른 성장을 보이고 있으며, 상반기 매출은 전년 대비 약 5배 증가할 것으로 예상된다. 다양한 규모의 의료기관들이 루닛의 AI 영상진단 솔루션을 도입하고 있으며, 이는 후지필름과의 파트너십 및 PMDA 승인 이후 가속화된 성과이다. 현재 루닛 인사이트 제품은 전 세계 600개 이상의 의료기관에서 활용되고 있다.",0.39215686274509803
exaone3.5,3,1442,"노랑풍선은 코로나19 이후 신혼여행을 놓친 고객들을 위해 '마이 허니문 기획전'을 진행하며, 휴양형, 관광형, 복합형 스타일의 다양한 여행 상품을 9월부터 12월까지 제공한다. 특히 칸쿤, 몰디브, 하와이 예약 시 추가 선물을 증정하고, 각 스타일별로 맞춤형 혜택과 전문 가이드 서비스를 포함하여 고객 만족을 높인다. 노랑풍선은 허니문 수요 증가에 대응하여 고객의 취향에 맞는 최고의 여행 경험을 제공할 계획이다.",0.303030303030303
exaone3.5,3,146,"소비자물가가 1998년 외환위기 이후 최고치인 6%를 기록하며, 석유류와 가공식품, 개인서비스 가격 상승이 주요 원인으로 지목되었다. 정부는 우크라이나 사태와 글로벌 공급망 차질로 인한 물가 상승을 우려하며, 민생 부담 완화를 위한 추가 대책을 마련 중이다. 현재까지 식품과 에너지 안정화, 취약계층 지원 등을 위한 정책들이 시행되고 있다.",0.23783783783783782
exaone3.5,3,1585,"NH투자증권은 포스코홀딩스의 목표주가를 37만원에서 31만원으로 하향 조정했으나 투자의견은 매수를 유지했다. 하반기 글로벌 철강 가격 하락으로 이익 감소가 예상되지만, 2분기 영업이익은 시장 기대치를 상회할 것으로 보인다. 중국 인프라 투자 기대에도 불구하고 금융 긴축으로 인한 경기 침체 우려와 재고 조정으로 철강 가격 약세가 지속될 전망이다.",0.38554216867469876
exaone3.5,3,1676,"미국 흑인 투자자들이 암호화폐 투자에 더 많이 참여하고 있으나, 최근 암호화폐 폭락으로 인해 이들 역시 큰 손실을 입고 있다. 찰스 슈왑의 조사에 따르면 흑인 투자자의 25%가 암호화폐에 투자하는 반면, 진입장벽이 낮고 저렴한 수수료 덕분에 금융 서비스 접근성이 제한적인 흑인들이 더 많이 참여했다. 그럼에도 불구하고 암호화폐 가격 하락에도 불구하고 흑인 투자자들의 투자 열기는 지속되고 있다.",0.3203883495145631
exaone3.5,3,17,수도권 레미콘 운송노조가 운송료 27% 인상 등을 요구하며 파업에 돌입하여 150여 개의 공장이 가동 중단되었다. 제조사들은 운송료 인상 폭을 9%대로 제한하고 있어 협상이 난항을 겪고 있다. 이 파업으로 건설업계는 공기 연장과 아파트 입주 지연 등의 피해를 우려하고 있다.,0.2916666666666667
exaone3.5,3,1705,"카카오 노조는 카카오모빌리티의 사모펀드 매각에 반대하며, 매각 시 사업 철수 가능성을 제기한 회사의 입장을 강력히 비판하고 있다. 노조는 매각 반대 서명 운동을 재개하고, 피켓 시위와 단체교섭 등 추가적인 행동을 계획 중이다. 카카오는 여전히 매각 여부를 결정 중이며, 다양한 의견을 수렴해 결정할 것이라고 밝혔다.",0.3209876543209876
exaone3.5,3,1725,"미국 독립기념일 연휴 기간 동안 약 4,800만 명이 장거리 여행을, 1,290만 명이 항공여행을 계획하며 팬데믹 이전 수준을 회복했다. 그러나 높은 유가와 항공료에도 불구하고 항공기 결항 및 지연이 급증해 여행객들에게 불편을 초래하고 있다. 이는 팬데믹 기간 인력 감축으로 인한 항공사의 수요 증가 대응 부족 때문으로 분석된다.",0.27777777777777773
exaone3.5,3,1751,"국토교통부는 이스타항공의 면허 발급 과정에서 회계자료 허위 제출 사실을 확인하고 특별조사와 감사를 실시하기로 했습니다. 이스타항공은 제출 자료에 자본잠식 사실이 누락되었다는 점을 인정하면서도, 기업회생 절차상의 제약과 회계시스템 복구 후의 정확한 결산 과정을 설명하며 오해 해소를 요청했습니다. 이로 인해 이스타항공의 항공운항증명 승인과 운항 재개가 지연될 가능성이 제기되고 있습니다.",0.26815642458100564
exaone3.5,3,1796,"한미글로벌은 사우디아라비아의 디리야 게이트 개발청(DGDA)으로부터 약 440억 원 규모의 대규모 주거 복합단지 조성 프로젝트 PM 용역을 수주했다. 이 프로젝트는 왕세자 주도 하에 디리야 지역에 최고급 빌라와 다양한 시설을 건설하는 것으로, 총 사업비는 약 200억 달러에 달한다. 한미글로벌은 2027년까지 프로젝트 관리와 설계 등을 담당하며, 최근 리야드의 대규모 주거 복합단지 조성 사업 PM 용역도 수주하는 등 사우디아라비아 건설 시장에서의 입지를 강화하고 있다.",0.3017543859649123
exaone3.5,3,1830,"카카오 노동조합은 카카오모빌리티 매각에 반대하며 임직원 서명운동과 시위를 재개했으나, 사측은 매각 외 다른 옵션은 고려하지 않는다는 입장을 고수하고 있다. 노조는 사측과의 대화를 지속하며 사회적 책임과 사업 성장 가능성을 강조하고 있지만, 카카오는 아직 매각 여부를 결정하지 않고 다양한 의견을 수렴 중이다. 양측 간 이견이 좁혀지지 않아 갈등이 지속되고 있다.",0.21319796954314724
exaone3.5,3,1835,"온라인 식자재 배달업체 컬리가 한국거래소에 재무적 투자자들의 의무보유 확약서를 제출하여 예비상장심사 통과 가능성이 높아졌으며, 이달 말 심사 통과 후 공모 절차를 시작할 것으로 예상됩니다. 그러나 현재 불안정한 증시 상황으로 인해 컬리의 기업 가치 평가에 어려움이 예상됩니다. 이에 따라 공모가 산정 과정에서 어려움이 예상됩니다.",0.3711340206185567
exaone3.5,3,1867,"코스피는 내년 1분기까지 하락 추세가 지속될 것으로 전망되며, 글로벌 경기 침체 우려와 주요 경제 이슈들이 하방 압력을 가하고 있다. 대신증권은 코스피의 하단을 2050선으로 제시하고, 경기 침체 가능성 증가에 따라 방어적인 투자 전략을 권장했다. 단기적으로는 7월 코스피 예상 밴드를 2250~2540선으로 전망하며, 물가 정점 통과 기대감과 통화정책 완화 가능성을 주목해야 한다고 분석했다.",0.25
exaone3.5,3,1875,"LG유플러스와 노키아는 5G 어드밴스드와 6G 기술 개발을 위한 협력 협약을 체결했다. 양사는 네트워크 확장 기술과 오픈랜 표준 기술 연구에 집중하며, 이를 통해 통신사의 네트워크 구축 유연성과 산업 혁신을 촉진할 계획이다. 특히 개방형 프론트홀과 클라우드 RAN 등 오픈랜 관련 핵심 기술의 공동 연구가 강조된다.",0.2993197278911565
